{
  "key": "test_video_gen.visual.text_overlays.v1",
  "category": "visual",
  "name": "text_overlays",
  "rule": "Non-diegetic on-screen text (headers like 'CALM WATERS' or 'PEAK VIEWS') must NOT be baked into Sora generations. Render clean scenes with Sora and add text using Remotion overlay layers in post.",
  "examples": [
    "GOOD: Sora renders ocean/mountains scenes; Remotion adds 'CALM WATERS' and 'PEAK VIEWS' headers.",
    "BAD: Sora prompt includes 'text overlay', causing baked-in text artifacts."
  ],
  "guidelines": [
    "Treat headers and captions as overlays for clarity and timing control.",
    "Only bake text when physically part of the scene (diegetic).",
    "Emit overlay copy and timing as structured metadata for Editor."
  ],
  "metadata": {
    "version": "1.0.0",
    "tags": ["guardrail", "visual", "text", "overlay"]
  },
  "links": {
    "project": "test_video_gen"
  }
}
